{
  "slug": "hello-world-computer",
  "title": "HELLO WORLD COMPUTER",
  "author": "Han × 1001",
  "year": 2026,
  "month": 6,
  "address": "0x6901afceb66564a9b6E7193561fB78F0878b5906",
  "facts": [
    ["TYPE", "single-layer perceptron"],
    ["SIZE", "1,024 weights (hashed text n-grams)"],
    ["STORAGE", "contract storage; int32 packed in uint256[128]"],
    ["TRAINING", "learns inside Ethereum — weights start at zero and update when each question settles"],
    ["OUTPUT", "a yes/no label with a confidence value"]
  ],
  "description": "This perceptron lives inside one contract. The contract stores the weights, trains them, and answers questions. You send it a short text (up to 64 bytes). ask() returns a yes/no label and a confidence value. All weights started at zero. Anyone can post a yes/no question for a fee. Each settled question updates the weights inside the contract.",
  "call": {
    "calldata": "0x189bf94f0000000000000000000000000000000000000000000000000000000000000020000000000000000000000000000000000000000000000000000000000000000b68656c6c6f20776f726c64000000000000000000000000000000000000000000",
    "expectedReturnBytes": 64,
    "note": "ask(text) — runs the model on your text and returns a label and confidence value.",
    "input": {
      "kind": "text",
      "label": "TEXT",
      "example": "hello world",
      "hint": "Use lowercase letters a–z and spaces only. Limit: 8 words and 64 bytes (64 characters with this alphabet).",
      "maxBytes": 64,
      "maxWords": 8,
      "pattern": "^(?=.*[a-z])[a-z ]+$",
      "patternMessage": "Use lowercase letters a–z and spaces only."
    }
  },
  "preview": {
    "kind": "fields",
    "fields": [
      { "label": "LABEL", "type": "uint8" },
      { "label": "CONFIDENCE", "type": "int256" }
    ]
  },
  "links": [
    { "label": "SITE", "url": "https://helloworldcomputer.ai" },
    { "label": "CONTRACT", "url": "https://evm.now/address/0x6901afceb66564a9b6e7193561fb78f0878b5906" }
  ]
}
