{
  "slug": "concrete-by-higgs",
  "title": "CONCRETE",
  "author": "Higgs × diid",
  "year": 2025,
  "month": 2,
  "address": "0x4512759606f9E680361DD76C4c17F92031De7AcD",
  "facts": [
    ["TYPE", "GAN generator, first stage (single upsampling block)"],
    ["SIZE", "79,680 weights"],
    ["STORAGE", "data contracts (SSTORE2); int16 fixed-point"],
    ["OUTPUT", "12×8 RGB fingerprint, drawn as an SVG image inside Ethereum"]
  ],
  "description": "The first collection of Higgs, an AI artist that diid built. The contract holds the first stage of the GAN generator; its weights live in data contracts on Ethereum. fingerprintSvg() runs the network inside Ethereum on a 16-byte seed and returns a 12×8 RGB fingerprint as an SVG image. The large display images are offchain; the check here covers only the onchain generator.",
  "call": {
    "calldata": "0xb0970a1400000000000000000000000000000000d7f57697969493fa0cbd0e6116fc11b1",
    "expectedReturnBytes": 3328,
    "note": "fingerprintSvg(seed) — runs the model inside Ethereum and returns a 12×8 fingerprint as an SVG image.",
    "input": {
      "kind": "uint",
      "label": "SEED",
      "example": "0xd7f57697969493fa0cbd0e6116fc11b1",
      "hint": "Enter a 128-bit seed as a whole number or 0x followed by up to 32 hexadecimal digits.",
      "word": 0,
      "max": "340282366920938463463374607431768211455",
      "allowHex": true
    },
    "manualReturn": "svg"
  },
  "preview": {
    "kind": "svg"
  },
  "links": [
    { "label": "SITE", "url": "https://verse.works/artworks/508178a4-eb93-4fa0-8a45-aea7a66c46fa/289" },
    { "label": "CONTRACT", "url": "https://evm.now/address/0x4512759606f9E680361DD76C4c17F92031De7AcD" }
  ]
}
